{
  "counts": {
    "categories": 8,
    "entries": 111,
    "sources": 8,
    "supplied_references": 43
  },
  "provenance": {
    "source_file": "02_Production_Planning/SHOT_TAXONOMY.json",
    "source_sha256": "9bcef464a4d56a99e43e4c095253998ca306b76aa709087d020b714f4ecddd29"
  },
  "registry_hash": "8d67032342fc6b5b074685feed9539f32f4f5c1f97c66fc03f1fe1091119a433",
  "schema_version": "filmstack-shot-taxonomy-registry/v1",
  "taxonomy": {
    "boundary": "This is a composable production-planning vocabulary, not an exhaustive artistic rulebook, camera authorization, safety approval, or substitute for story purpose and department review.",
    "categories": {
      "CAMERA_ANGLE": {
        "entries": [
          {
            "aliases": [
              "Neutral angle"
            ],
            "code": "ANGLE_EYE",
            "definition": "Camera looks from approximately the subject's eye level.",
            "supplied_refs": [
              16
            ],
            "value": "Eye Level"
          },
          {
            "aliases": [],
            "code": "ANGLE_LOW",
            "definition": "Camera looks upward from below the subject's eye line.",
            "supplied_refs": [
              17
            ],
            "value": "Low Angle"
          },
          {
            "aliases": [],
            "code": "ANGLE_HIGH",
            "definition": "Camera looks downward from above the subject's eye line.",
            "supplied_refs": [
              18
            ],
            "value": "High Angle"
          },
          {
            "aliases": [
              "Dutch angle",
              "Canted angle"
            ],
            "code": "ANGLE_DUTCH",
            "definition": "The horizon is intentionally tilted.",
            "supplied_refs": [
              19
            ],
            "value": "Dutch / Canted"
          },
          {
            "aliases": [
              "Bird's eye"
            ],
            "code": "ANGLE_BIRD",
            "definition": "A very high view emphasizing spatial overview rather than strict nadir geometry.",
            "supplied_refs": [
              20
            ],
            "value": "Bird's-Eye / Aerial Overview"
          },
          {
            "aliases": [
              "Top down",
              "Nadir"
            ],
            "code": "ANGLE_TOP",
            "definition": "Camera points approximately straight down toward the subject.",
            "supplied_refs": [
              21
            ],
            "value": "Top-Down / Overhead"
          },
          {
            "aliases": [
              "Worm's eye"
            ],
            "code": "ANGLE_WORM",
            "definition": "An extreme low view looking strongly upward.",
            "supplied_refs": [
              22
            ],
            "value": "Worm's-Eye"
          },
          {
            "aliases": [],
            "code": "ANGLE_GROUND",
            "definition": "Camera is placed near the ground; viewing direction may remain level.",
            "supplied_refs": [],
            "value": "Ground-Level"
          },
          {
            "aliases": [],
            "code": "ANGLE_AERIAL_OBLIQUE",
            "definition": "Elevated or airborne view that is not straight down.",
            "supplied_refs": [],
            "value": "Aerial Oblique"
          },
          {
            "aliases": [],
            "code": "ANGLE_CUSTOM",
            "definition": "A project-specific angle defined in Notes.",
            "supplied_refs": [],
            "value": "Other / Custom Angle"
          }
        ],
        "label": "Camera Angle"
      },
      "CAMERA_MOVEMENT": {
        "entries": [
          {
            "aliases": [
              "Locked shot"
            ],
            "code": "MOVE_STATIC",
            "definition": "Camera position and orientation remain fixed.",
            "supplied_refs": [],
            "value": "Static / Locked-Off"
          },
          {
            "aliases": [],
            "code": "MOVE_PAN",
            "definition": "Camera rotates horizontally from a fixed or moving support.",
            "supplied_refs": [
              23
            ],
            "value": "Pan"
          },
          {
            "aliases": [],
            "code": "MOVE_TILT",
            "definition": "Camera rotates vertically from a fixed or moving support.",
            "supplied_refs": [
              24
            ],
            "value": "Tilt"
          },
          {
            "aliases": [],
            "code": "MOVE_ROLL",
            "definition": "Camera rotates around the lens axis during the shot.",
            "supplied_refs": [],
            "value": "Camera Roll"
          },
          {
            "aliases": [
              "Tracking shot",
              "Follow shot"
            ],
            "code": "MOVE_TRACK",
            "definition": "Camera travels with or follows a moving subject.",
            "supplied_refs": [
              25
            ],
            "value": "Tracking / Follow"
          },
          {
            "aliases": [],
            "code": "MOVE_LEAD",
            "definition": "Camera travels ahead of a subject while maintaining orientation toward them.",
            "supplied_refs": [],
            "value": "Lead / Retreat"
          },
          {
            "aliases": [
              "Crab move"
            ],
            "code": "MOVE_TRUCK",
            "definition": "Camera translates laterally left or right.",
            "supplied_refs": [],
            "value": "Truck / Lateral Slide"
          },
          {
            "aliases": [],
            "code": "MOVE_PEDESTAL_UP",
            "definition": "Camera translates vertically upward without tilting.",
            "supplied_refs": [],
            "value": "Pedestal / Boom Up"
          },
          {
            "aliases": [],
            "code": "MOVE_PEDESTAL_DOWN",
            "definition": "Camera translates vertically downward without tilting.",
            "supplied_refs": [],
            "value": "Pedestal / Boom Down"
          },
          {
            "aliases": [],
            "code": "MOVE_PUSH_IN",
            "definition": "Camera moves closer to the subject; support is recorded separately.",
            "supplied_refs": [
              26
            ],
            "value": "Push In"
          },
          {
            "aliases": [
              "Pull back",
              "Push out"
            ],
            "code": "MOVE_PULL_OUT",
            "definition": "Camera moves farther from the subject; support is recorded separately.",
            "supplied_refs": [
              27
            ],
            "value": "Pull Out / Push Out"
          },
          {
            "aliases": [],
            "code": "MOVE_DOLLY_IN",
            "definition": "Camera physically translates inward using a dolly or dolly-like path.",
            "supplied_refs": [
              28
            ],
            "value": "Dolly In"
          },
          {
            "aliases": [],
            "code": "MOVE_DOLLY_OUT",
            "definition": "Camera physically translates outward using a dolly or dolly-like path.",
            "supplied_refs": [
              29
            ],
            "value": "Dolly Out"
          },
          {
            "aliases": [],
            "code": "MOVE_ARC",
            "definition": "Camera travels around the subject on a curved path.",
            "supplied_refs": [],
            "value": "Arc / Orbit"
          },
          {
            "aliases": [
              "Crane shot"
            ],
            "code": "MOVE_CRANE",
            "definition": "Camera travels on a crane or jib path; record the rig separately.",
            "supplied_refs": [
              32
            ],
            "value": "Crane / Jib Move"
          },
          {
            "aliases": [
              "Whip pan"
            ],
            "code": "MOVE_WHIP_PAN",
            "definition": "A deliberately very fast pan creates directional blur.",
            "supplied_refs": [
              31
            ],
            "value": "Whip / Swish Pan"
          },
          {
            "aliases": [],
            "code": "MOVE_SLIDER",
            "definition": "Short controlled translation along a slider.",
            "supplied_refs": [],
            "value": "Slider Move"
          },
          {
            "aliases": [],
            "code": "MOVE_REVEAL",
            "definition": "Movement deliberately uncovers new story information.",
            "supplied_refs": [],
            "value": "Reveal Move"
          },
          {
            "aliases": [
              "Aerial move"
            ],
            "code": "MOVE_FLYOVER",
            "definition": "Airborne travelling movement.",
            "supplied_refs": [],
            "value": "Drone / Flyover"
          },
          {
            "aliases": [],
            "code": "MOVE_CUSTOM",
            "definition": "A compound or project-specific move defined in Notes.",
            "supplied_refs": [],
            "value": "Other / Compound Movement"
          }
        ],
        "label": "Camera Movement"
      },
      "CAPTURE_MODE": {
        "entries": [
          {
            "aliases": [],
            "code": "CAPTURE_NORMAL",
            "definition": "Capture and playback use the intended normal-motion relationship.",
            "supplied_refs": [],
            "value": "Normal Speed"
          },
          {
            "aliases": [
              "High speed"
            ],
            "code": "CAPTURE_SLOW",
            "definition": "Higher capture rate is played back more slowly; record exact FPS.",
            "supplied_refs": [],
            "value": "Slow Motion / High-Speed"
          },
          {
            "aliases": [
              "Undercrank"
            ],
            "code": "CAPTURE_FAST",